Bureau of Justice Statistics,,,,,,
Filename: p08t01.csv,,,,,,
"Table 1. Number of prisoners under state and federal jurisdiction, by sentence length, race, Hispanic origin, and gender, 2008",,,,,,
Report title: Prisoners in 2008 NCJ 228417,,,,,,
"Data source: National Prisoner Statistics, 1b",,,,,,
"Authors: William J. Sabol, Ph.D., Heather C. West, Ph.D., and Matthew Cooper",,,,,,
Refer questions to: askbjs@usdoj.gov   202-307-0765,,,,,,
"Date of version: December 8, 2009",,,,,,
,,,,,,
"Table 1: Number of prisoners under state and federal jurisdiction, by sentence length, race, Hispanic origin, and gender, 2008",,,,,,
Prisoners by sentence length,,Total,,Male,,Female
,Total under jurisdiction,"1,610,446",,"1,495,594",,"114,852"
,Sentenced to more than 1 year,"1,540,036",,"1,434,784",,"105,252"
Estimated prisoners by race/a,,,,,,
,White/b,"591,900",,"562,800",,"29,100"
,Black/b,"528,200",,"477,500",,"50,700"
,Hispanic,"313,100",,"295,800",,"17,300"
"a/Based on prisoners sentenced to more than 1 year. Excludes American Indians, Alaska Natives, Asians, Native Hawaiians, other Pacific Islanders, and persons identifying two or more races. ",,,,,,
b/Excludes persons of Hispanic or Latino origin. ,,,,,,
